{
  "id": "software-requirements-specification",
  "name": "Software Requirements Specification",
  "version": "1.0.0",
  "category": "specifications",
  "type": "technical",
  "description": "Formal SRS document defining functional and non-functional requirements",
  "author": "DevDocAI",
  "tags": ["requirements", "srs", "specifications", "functional", "non-functional"],
  "variables": [
    {
      "name": "USER_INPUT",
      "description": "User's requirements and project details",
      "required": true,
      "type": "text"
    },
    {
      "name": "PROJECT_NAME",
      "description": "Name of the software project",
      "required": false,
      "default": "Software System"
    },
    {
      "name": "VERSION",
      "description": "Document version",
      "required": false,
      "default": "1.0"
    }
  ],
  "sections": [
    {
      "id": "introduction",
      "title": "Introduction",
      "required": true,
      "order": 1
    },
    {
      "id": "overall-description",
      "title": "Overall Description",
      "required": true,
      "order": 2
    },
    {
      "id": "specific-requirements",
      "title": "Specific Requirements",
      "required": true,
      "order": 3
    },
    {
      "id": "system-features",
      "title": "System Features",
      "required": true,
      "order": 4
    },
    {
      "id": "external-interfaces",
      "title": "External Interface Requirements",
      "required": true,
      "order": 5
    },
    {
      "id": "non-functional",
      "title": "Non-functional Requirements",
      "required": true,
      "order": 6
    }
  ],
  "template": "# Software Requirements Specification\n## {{PROJECT_NAME}}\n### Version {{VERSION}}\n\n---\n\n## 1. Introduction\n\n### 1.1 Purpose\nThis Software Requirements Specification (SRS) document provides a complete description of all the functional and non-functional requirements for {{PROJECT_NAME}}. It defines what the software product is expected to do, including expected behaviors and quality attributes.\n\n### 1.2 Document Conventions\n- **SHALL**: Mandatory requirement\n- **SHOULD**: Recommended requirement\n- **MAY**: Optional requirement\n- **Priority Levels**: High (H), Medium (M), Low (L)\n\n### 1.3 Intended Audience\nThis document is intended for:\n- Development team members\n- Project managers\n- Quality assurance engineers\n- Business stakeholders\n- System architects\n- End users\n\n### 1.4 Product Scope\nBased on the provided requirements:\n{{USER_INPUT}}\n\nThe software system will provide comprehensive functionality to meet these specified needs.\n\n### 1.5 References\n- [IEEE 830-1998 Standard for Software Requirements Specifications]\n- [Project charter and vision documents]\n- [Related technical documentation]\n\n## 2. Overall Description\n\n### 2.1 Product Perspective\n{{PROJECT_NAME}} is a [standalone/integrated] system that will [main purpose and context].\n\n#### 2.1.1 System Interfaces\n- Integration with existing systems\n- Data exchange protocols\n- Communication interfaces\n\n#### 2.1.2 User Interfaces\n- Web-based interface\n- Mobile application interface\n- Command-line interface (if applicable)\n- API interfaces\n\n#### 2.1.3 Hardware Interfaces\n- Server requirements\n- Client device requirements\n- Peripheral device support\n\n#### 2.1.4 Software Interfaces\n- Operating system compatibility\n- Database management systems\n- Third-party software dependencies\n- API integrations\n\n### 2.2 Product Functions\nThe major functions of {{PROJECT_NAME}} include:\n\n1. **Core Functionality**\n   - [Function 1]: [Description]\n   - [Function 2]: [Description]\n   - [Function 3]: [Description]\n\n2. **Supporting Functions**\n   - User management and authentication\n   - Data management and storage\n   - Reporting and analytics\n   - System administration\n\n### 2.3 User Classes and Characteristics\n\n| User Class | Description | Technical Expertise | Frequency of Use |\n|------------|-------------|-------------------|------------------|\n| Administrator | System configuration and maintenance | High | Daily |\n| End User | Primary system users | Low-Medium | Daily |\n| Manager | Report viewing and approvals | Medium | Weekly |\n| Support Staff | User assistance and troubleshooting | Medium-High | Daily |\n\n### 2.4 Operating Environment\n\n#### Hardware Platform\n- Server specifications\n- Client specifications\n- Network requirements\n\n#### Software Platform\n- Operating systems\n- Web browsers supported\n- Database systems\n- Application servers\n\n### 2.5 Design and Implementation Constraints\n\n1. **Regulatory Constraints**\n   - Compliance requirements\n   - Data protection regulations\n   - Industry standards\n\n2. **Technical Constraints**\n   - Programming language requirements\n   - Database limitations\n   - Performance constraints\n\n3. **Business Constraints**\n   - Budget limitations\n   - Timeline restrictions\n   - Resource availability\n\n### 2.6 Assumptions and Dependencies\n\n#### Assumptions\n- Users have basic computer literacy\n- Stable internet connectivity available\n- Required hardware infrastructure in place\n\n#### Dependencies\n- Third-party service availability\n- External API stability\n- License availability for required software\n\n## 3. Specific Requirements\n\n### 3.1 Functional Requirements\n\n#### FR-001: User Authentication\n**Priority**: High  \n**Description**: The system SHALL provide secure user authentication  \n**Acceptance Criteria**:\n- Users can login with username and password\n- Password must meet complexity requirements\n- Session timeout after inactivity\n- Multi-factor authentication support\n\n#### FR-002: Data Management\n**Priority**: High  \n**Description**: The system SHALL provide CRUD operations for all data entities  \n**Acceptance Criteria**:\n- Create new records with validation\n- Read/retrieve records with filtering\n- Update existing records with audit trail\n- Delete records with soft delete option\n\n#### FR-003: Reporting\n**Priority**: Medium  \n**Description**: The system SHALL generate various reports  \n**Acceptance Criteria**:\n- Pre-defined report templates\n- Custom report builder\n- Export to multiple formats (PDF, Excel, CSV)\n- Scheduled report generation\n\n#### FR-004: User Management\n**Priority**: High  \n**Description**: The system SHALL provide comprehensive user management  \n**Acceptance Criteria**:\n- User creation and deactivation\n- Role-based access control\n- Permission management\n- User activity logging\n\n#### FR-005: Data Import/Export\n**Priority**: Medium  \n**Description**: The system SHALL support data import and export  \n**Acceptance Criteria**:\n- Bulk data import from CSV/Excel\n- Data validation during import\n- Export data in multiple formats\n- API for programmatic access\n\n### 3.2 Use Cases\n\n#### UC-001: User Login\n**Primary Actor**: End User  \n**Preconditions**: User account exists  \n**Main Flow**:\n1. User navigates to login page\n2. User enters credentials\n3. System validates credentials\n4. System creates user session\n5. User redirected to dashboard\n\n**Alternative Flows**:\n- Invalid credentials: Display error message\n- Account locked: Show account recovery options\n- First-time login: Force password change\n\n## 4. System Features\n\n### 4.1 Feature: User Dashboard\n\n#### 4.1.1 Description\nA personalized dashboard providing users with relevant information and quick access to frequently used functions.\n\n#### 4.1.2 Functional Requirements\n- REQ-4.1.1: Display user-specific metrics and KPIs\n- REQ-4.1.2: Customizable widget layout\n- REQ-4.1.3: Real-time data updates\n- REQ-4.1.4: Quick action buttons\n- REQ-4.1.5: Notification center integration\n\n### 4.2 Feature: Advanced Search\n\n#### 4.2.1 Description\nComprehensive search functionality across all system data with filtering and sorting capabilities.\n\n#### 4.2.2 Functional Requirements\n- REQ-4.2.1: Full-text search across all entities\n- REQ-4.2.2: Advanced filter options\n- REQ-4.2.3: Search result ranking\n- REQ-4.2.4: Save search criteria\n- REQ-4.2.5: Search history\n\n### 4.3 Feature: Workflow Management\n\n#### 4.3.1 Description\nAutomate and manage business processes with configurable workflows.\n\n#### 4.3.2 Functional Requirements\n- REQ-4.3.1: Visual workflow designer\n- REQ-4.3.2: Conditional routing\n- REQ-4.3.3: Approval mechanisms\n- REQ-4.3.4: Email notifications\n- REQ-4.3.5: Workflow monitoring\n\n## 5. External Interface Requirements\n\n### 5.1 User Interfaces\n\n#### 5.1.1 General UI Requirements\n- Responsive design for multiple screen sizes\n- Consistent navigation structure\n- Accessibility compliance (WCAG 2.1 AA)\n- Multi-language support\n- Theme customization\n\n#### 5.1.2 Screen Layouts\n- Header with navigation menu\n- Main content area\n- Sidebar for contextual information\n- Footer with links and information\n\n### 5.2 Hardware Interfaces\n\n#### 5.2.1 Client Hardware\n- Minimum screen resolution: 1024x768\n- Input devices: Keyboard, mouse, touchscreen\n- Camera for video conferencing (optional)\n- Printer support for reports\n\n#### 5.2.2 Server Hardware\n- CPU: Minimum 8 cores\n- RAM: Minimum 16GB\n- Storage: SSD with 500GB minimum\n- Network: Gigabit Ethernet\n\n### 5.3 Software Interfaces\n\n#### 5.3.1 Database Interface\n- Database Type: [PostgreSQL/MySQL/MongoDB]\n- Connection pooling\n- Transaction support\n- Backup and recovery interfaces\n\n#### 5.3.2 External API Interfaces\n\n| API Name | Purpose | Protocol | Format | Authentication |\n|----------|---------|----------|--------|----------------|\n| Payment Gateway | Process payments | HTTPS | JSON | OAuth 2.0 |\n| Email Service | Send notifications | HTTPS | JSON | API Key |\n| SMS Gateway | Send SMS alerts | HTTPS | XML | Basic Auth |\n| Analytics | Track usage | HTTPS | JSON | API Key |\n\n### 5.4 Communications Interfaces\n\n#### 5.4.1 Network Protocols\n- HTTP/HTTPS for web communication\n- WebSocket for real-time updates\n- SMTP for email communication\n- FTP/SFTP for file transfers\n\n#### 5.4.2 Data Formats\n- JSON for API communication\n- XML for legacy system integration\n- CSV for data import/export\n- PDF for report generation\n\n## 6. Non-functional Requirements\n\n### 6.1 Performance Requirements\n\n#### NFR-001: Response Time\n**Requirement**: System response time SHALL not exceed:\n- Page load: < 2 seconds\n- API response: < 500ms\n- Search results: < 3 seconds\n- Report generation: < 10 seconds for standard reports\n\n#### NFR-002: Throughput\n**Requirement**: System SHALL support:\n- Concurrent users: 1000+\n- Transactions per second: 100+\n- Data processing: 10GB per hour\n\n#### NFR-003: Resource Utilization\n**Requirement**: System resource usage SHALL not exceed:\n- CPU utilization: < 70% average\n- Memory usage: < 80% of available\n- Network bandwidth: < 60% of capacity\n\n### 6.2 Security Requirements\n\n#### NFR-004: Authentication and Authorization\n- Multi-factor authentication support\n- Role-based access control (RBAC)\n- Session management with timeout\n- Password complexity enforcement\n- Account lockout after failed attempts\n\n#### NFR-005: Data Protection\n- Encryption at rest (AES-256)\n- Encryption in transit (TLS 1.3)\n- PII data masking\n- Secure key management\n- Regular security audits\n\n#### NFR-006: Compliance\n- GDPR compliance for data privacy\n- HIPAA compliance (if healthcare)\n- PCI DSS compliance (if payment processing)\n- SOC 2 Type II certification\n\n### 6.3 Reliability Requirements\n\n#### NFR-007: Availability\n**Requirement**: System availability SHALL be:\n- Uptime: 99.9% (excluding planned maintenance)\n- Planned maintenance window: < 4 hours/month\n- Recovery Time Objective (RTO): < 4 hours\n- Recovery Point Objective (RPO): < 1 hour\n\n#### NFR-008: Fault Tolerance\n- Graceful degradation under load\n- Automatic failover mechanisms\n- Data replication and backup\n- Error logging and monitoring\n\n### 6.4 Maintainability Requirements\n\n#### NFR-009: Code Quality\n- Code coverage: > 80%\n- Cyclomatic complexity: < 10\n- Documentation coverage: 100% for public APIs\n- Coding standards compliance\n\n#### NFR-010: Modularity\n- Microservices architecture\n- Loose coupling between components\n- Well-defined interfaces\n- Version control for all components\n\n### 6.5 Portability Requirements\n\n#### NFR-011: Platform Independence\n- Cross-browser compatibility\n- Operating system independence\n- Database abstraction layer\n- Container deployment support\n\n### 6.6 Scalability Requirements\n\n#### NFR-012: Horizontal Scaling\n- Support for load balancing\n- Stateless application design\n- Distributed caching\n- Database sharding capability\n\n#### NFR-013: Vertical Scaling\n- Efficient resource utilization\n- Configurable resource limits\n- Performance optimization\n\n### 6.7 Usability Requirements\n\n#### NFR-014: User Experience\n- Intuitive navigation\n- Consistent UI patterns\n- Context-sensitive help\n- Keyboard shortcuts\n- Mobile responsiveness\n\n#### NFR-015: Accessibility\n- WCAG 2.1 Level AA compliance\n- Screen reader compatibility\n- Keyboard navigation\n- High contrast mode\n- Text size adjustment\n\n### 6.8 Localization Requirements\n\n#### NFR-016: Internationalization\n- Multi-language support\n- Right-to-left language support\n- Local date/time formats\n- Currency formatting\n- Cultural considerations\n\n## 7. Other Requirements\n\n### 7.1 Legal Requirements\n- Software licensing compliance\n- Terms of service agreement\n- Privacy policy implementation\n- Data retention policies\n- Audit trail requirements\n\n### 7.2 Operational Requirements\n- Backup procedures\n- Monitoring and alerting\n- Incident response procedures\n- Change management process\n- Documentation requirements\n\n## Appendices\n\n### Appendix A: Glossary\n\n| Term | Definition |\n|------|------------|\n| API | Application Programming Interface |\n| CRUD | Create, Read, Update, Delete |\n| GDPR | General Data Protection Regulation |\n| RBAC | Role-Based Access Control |\n| SRS | Software Requirements Specification |\n| UI | User Interface |\n| WCAG | Web Content Accessibility Guidelines |\n\n### Appendix B: Analysis Models\n- Data flow diagrams\n- Entity-relationship diagrams\n- State transition diagrams\n- Use case diagrams\n\n### Appendix C: Change Log\n\n| Version | Date | Changes | Author |\n|---------|------|---------|--------|\n| 1.0 | [Date] | Initial version | DevDocAI |\n\n---\n\n*Document prepared by*: DevDocAI Template System  \n*Last updated*: [Current Date]  \n*Status*: [Draft/Review/Approved]"
}